{
  "schema_version": "evidence/v1",
  "artifact_id": "T2-W2b-incident-recovery-20260908",
  "kind": "probe",
  "status": "RED",
  "observed_at": "2026-09-08T02:45:15Z",
  "source": {
    "repository": "HuGR-Labs/corelink-runners",
    "commit_sha": "4e2aff7a30b100bb06d24a79609d4644db38023d",
    "path": "docs/plan/evidence/T2-W2b-incident-recovery-20260908.json"
  },
  "claims": [
    "fabricd.recreated",
    "fabricd.digest.pinned",
    "fabricd.instance.running",
    "fabricd.health.200",
    "fabricd.attestation.200",
    "spawn.rollback.cb704.100",
    "devenv.d105.ready",
    "fleet.idle.0.0.0",
    "autoscaler.paused.1.1",
    "historical.fabricd.version26.unrestored",
    "incident.rootcause.containers-rollout-none"
  ],
  "version": {
    "id": "20a35c28-bb45-478a-9ffa-096b703057f1",
    "digest": "sha256:2e7bcea926f4ce2b38edb1a381f3821fcf4c898377e4f988b763fd3232c0e565"
  },
  "evidence": {
    "fabricd": {
      "app_name": "corelink-fabricd-fabricdcontainer",
      "app_uuid": "a03e645c-9589-401c-84a0-e023ff2b6749",
      "worker_version": "20a35c28-bb45-478a-9ffa-096b703057f1",
      "instance_id": "12e222c7ce4f7e3854933755482a6d74d8ff9b14bec171966f0a5947984db3f4",
      "instance_state": "running",
      "provider_version": 1,
      "image_digest": "sha256:2e7bcea926f4ce2b38edb1a381f3821fcf4c898377e4f988b763fd3232c0e565",
      "health": {"v1_health_http": 200, "attestation_key_http": 200, "attestation_key_id_prefix": "faa5b7726ccd2c52"}
    },
    "spawn_worker": {
      "rollback_target": "cb704a9d-f6e0-45d7-9e68-89a263a77993",
      "rollback_deployment": "200ea7f0-cd1b-47b2-8986-66ad6344612e",
      "active_percent": 100
    },
    "fleet_gate": {"busy": 0, "checked": 0, "unverifiable": 0, "force": false},
    "autoscaler": {"intake_paused": 1, "redrive_paused": 1},
    "devenv": {"app_uuid": "a037c709-9f21-493c-8dcb-2414a588a1cd", "state": "ready", "image_digest": "sha256:d105e11f92718d610b390a71c37acb9bfb668da278b2f80c1f617f7cd068768c"},
    "commands_redacted": [
      "npx wrangler deploy --config wrangler.jsonc --name corelink-fabricd --containers-rollout=none",
      "npx wrangler deploy --config wrangler.jsonc --name corelink-fabricd --containers-rollout=immediate",
      "npx wrangler containers info <fabricd-app-uuid> --json",
      "npx wrangler containers instances <fabricd-app-uuid> --json",
      "npx wrangler rollback cb704a9d-f6e0-45d7-9e68-89a263a77993 --name corelink-spawn-worker --yes",
      "POLL_INTERVAL_SECS=5 DEADLINE_SECS=30 FLEET_BUSY_READ_KEY=<OOB_FILE> scripts/ci/wait-for-idle-fleet.sh"
    ]
  },
  "notes": "The no-container rollout deployed the Worker but intentionally skipped container application creation, leaving fabricd absent. Immediate rollout recreated the named app with a new UUID and provider version 1; historical provider version 26 was not recoverable through normal deployment. Service is operational on the pinned digest, but the version-26 restoration criterion remains RED. Spawn Worker rollback to cb704 succeeded at 100%. No unpause, delete, secret disclosure, or test was performed."
}
