{
  "schema_version": "evidence/v1",
  "artifact_id": "t6-w4-owner-config-template-2026-09-07",
  "kind": "decision",
  "status": "RED",
  "observed_at": "2026-09-07T00:00:00Z",
  "source": {
    "repository": "corelink-runners",
    "commit_sha": "f27de8ff384ce4bb6fea32dbbdea96f55b0c8a93",
    "path": "docs/plan/evidence/T6-W4-owner-config-template.json"
  },
  "claims": [],
  "version": {
    "id": "f27de8ff384ce4bb6fea32dbbdea96f55b0c8a93"
  },
  "evidence": {
    "original": {
      "schema_version": "evidence/v1",
      "artifact_id": "t6-w4-owner-config-template-2026-09-07",
      "kind": "configuration-readiness",
      "status": "READY-PENDING-DEPLOYMENT",
      "source_commit": "a2c18f6b2621824bd12a2a34426215efe9dfeec5",
      "runtime": {
        "provider": "aws",
        "region": "us-east-1",
        "monitor_account_id": "975306274105",
        "sensitivity_account_id": "286590629898",
        "verifier_account_id": "888348805607",
        "resource_prefix": "corelink-monitor",
        "state_table": "corelink-monitor-state",
        "state_namespace": "corelink-monitor/prod/v1",
        "journal_prefix": "journal/corelink-monitor/prod/v1/",
        "journal_retention_ms": 691200000,
        "destination": "corelink-monitor-ops",
        "sns_topic_name": "corelink-monitor-receipts",
        "http_route": "POST /v1/ingest",
        "named_ingest_host": "monitor.corelink.humangr.com",
        "named_ingest_url": "https://monitor.corelink.humangr.com/v1/ingest",
        "source": "canary-tick",
        "service": "corelink-canary",
        "application": "corelink-runners",
        "key_id": "canary-tick-key-current",
        "credential_epoch": "1",
        "interval_ms": 300000,
        "allowed_kinds": [
          "canary-tick",
          "CANARY_CONFIG_INVALID"
        ],
        "trusted_time_endpoint": "http://timestamp.digicert.com",
        "max_pending_deliveries_per_source": 100
      },
      "secret_names_only": [
        "CANARY_TICK_ENVELOPE_HMAC_KEY",
        "corelink/monitor/source/canary-tick-v1",
        "corelink/monitor/MONITOR_CONFIG_JSON"
      ],
      "unresolved_deployment_outputs": [
        "API Gateway custom-domain/DNS certificate and mapping",
        "state/journal/topic/witness qualified ARNs",
        "immutable ECR image digest and Lambda published version",
        "source secret immutable VersionId",
        "monitor rearm tuple digest, signer manifest/public identities and epochs",
        "on-call schedule digest"
      ],
      "probe_card": "docs/plan/execution/2026-09-07-t6-w4-live-execution-card.md",
      "verdict": "READY-PENDING-DEPLOYMENT"
    }
  },
  "notes": "Canonical inventory record preserving the original candidate evidence payload. Status is explicit and remains RED when deployment or live proof is pending."
}
