{
  "schema_version": "evidence/v1",
  "artifact_id": "t2-w2b-a2-7-final-20260908",
  "kind": "probe",
  "status": "RED",
  "observed_at": "2026-09-08T01:37:55Z",
  "source": {
    "repository": "corelink-runners",
    "commit_sha": "48052654943cffaf6827a2a7a729012d2aa2df5b",
    "path": "docs/plan/evidence/T2-W2b-A2.7-final-20260908.json"
  },
  "claims": ["A2.7"],
  "version": {"id": "48052654943cffaf6827a2a7a729012d2aa2df5b"},
  "evidence": {
    "preflight": {
      "tip_clean": true,
      "dry_run": "PASS",
      "dry_run_bindings": ["RunnerContainer", "CheckHostContainer", "CredStashDO", "MetricsDO", "ConcurrencySlotsDO", "RunnerDevEnvDO", "ContainmentDO"],
      "dry_run_containers": {
        "runner": "registry.cloudflare.com/6a1fc1c626fc2628823e60b9db01f5cd/corelink-spawn-worker-runnercontainer@sha256:2f3dd8a166e890888d026669757c996750b42230a04710fa08f13db56b0cf029",
        "checkhost": "registry.cloudflare.com/6a1fc1c626fc2628823e60b9db01f5cd/corelink-spawn-worker-checkhostcontainer@sha256:4e09fc21ddc437684a921fdeedbf5c98264a7a7db77dbc76dae3a4ea75017851",
        "devenv": "registry.cloudflare.com/6a1fc1c626fc2628823e60b9db01f5cd/corelink-runner-devenv@sha256:d105e11f92718d610b390a71c37acb9bfb668da278b2f80c1f617f7cd068768c"
      },
      "paused_flags": {"AUTOSCALER_INTAKE_PAUSED": "1", "AUTOSCALER_REDRIVE_PAUSED": "1"},
      "pre_gate": {"busy": 0, "checked": 0, "unverifiable": 0, "force": false, "status": "PASS"}
    },
    "deploy": {
      "command": "npx wrangler deploy --config wrangler.jsonc --name corelink-spawn-worker",
      "deployment_id": "f2f8a0be-65d7-41f6-9c69-6813e4d9b7c0",
      "candidate_worker_version": "85171fd2-fc5b-49c2-b6f3-fc21d6fe8977",
      "candidate_traffic_percentage": 100,
      "candidate_worker_authenticated_gate": {"http": 200, "busy": 0, "checked": 0, "unverifiable": 0, "schema_keys": ["busy", "checked", "runners", "unverifiable"]},
      "devenv": {"id": "a037c709-9f21-493c-8dcb-2414a588a1cd", "name": "corelink-spawn-worker-runnerdevenvdo", "version": 1, "state": "ready", "image": "registry.cloudflare.com/6a1fc1c626fc2628823e60b9db01f5cd/corelink-runner-devenv@sha256:d105e11f92718d610b390a71c37acb9bfb668da278b2f80c1f617f7cd068768c"}
    },
    "A2.5_recheck_during_final_close": {
      "status": "RED",
      "fabricd_app_id": "a0337af9-26db-42c0-a816-0a63ba0e58a3",
      "fabricd_version": 26,
      "fabricd_image": "registry.cloudflare.com/6a1fc1c626fc2628823e60b9db01f5cd/corelink-fabricd-fabricdcontainer@sha256:2e7bcea926f4ce2b38edb1a381f3821fcf4c898377e4f988b763fd3232c0e565",
      "provider_health": {"active": 0, "assigned": 1, "healthy": 0, "stopped": 0, "failed": 0},
      "instance_state_observed": "stopped",
      "health_routes": [{"url": "https://corelink-fabricd.gmhelmold.workers.dev/health", "http": 200, "body": "ok"}, {"url": "https://corelink-fabricd.gmhelmold.workers.dev/v1/health", "http": 200, "body": "ok"}],
      "reason": "HTTP health remained 200, but the provider did not report an effectively running/healthy fabricd instance at the final verification window."
    },
    "rollback": {
      "command": "npx wrangler rollback cb704a9d-f6e0-45d7-9e68-89a263a77993 --name corelink-spawn-worker --yes --message 'rollback final A2.7 fabricd instance not running'",
      "deployment_id": "3d7050d1-f72f-4e46-ab61-3c790cd0b2ca",
      "active_worker_version": "cb704a9d-f6e0-45d7-9e68-89a263a77993",
      "traffic_percentage": 100,
      "fabricd_changed": false
    },
    "post_rollback": {
      "authenticated_fleet_gate": {"http": 200, "busy": 0, "checked": 0, "unverifiable": 0},
      "gate": {"busy": 0, "checked": 0, "unverifiable": 0, "force": false, "status": "PASS"},
      "runner_checkhost_refs_unchanged": true,
      "paused_flags_preserved": true
    },
    "local_ci_substitution": {
      "workflow": ".github/workflows/deploy-spawn-worker.yml",
      "owner_authorized_billing_exception": true,
      "green_gate_commit": "9273080e0485a202bdca5f1c2899e5169fb48e45",
      "current_tip_delta_from_green_gate": "docs-only",
      "commands": ["npm ci", "npm run typecheck", "npm run test"],
      "result": "PASS at 9273080e; current tip contains no code delta from that green gate"
    },
    "scope_note": "Candidate deployment and Worker health/gate proofs passed, but final A2.5 recheck failed on provider instance state. Worker was rolled back to cb704. A2.7 receives no green credit."
  }
}
