{
  "schema_version": "evidence/v1",
  "artifact_id": "t3-w18-containment-live",
  "kind": "test+probe",
  "status": "RED",
  "observed_at": "2026-09-07T01:15:00Z",
  "source": {
    "repository": "corelink-runners",
    "commit_sha": "b3e8618f14aebb9e43988fb62ce80054a2624f6d",
    "path": "docs/plan/evidence/T3-W18-containment-live.json"
  },
  "claims": ["A3.30", "T3-W18"],
  "version": { "id": "d04aa4ea-80a3-481e-9f2e-e785e8824480" },
  "evidence": {
    "scope": "RCA, fix, and version-bound three-state live containment probe; final safe posture retained",
    "target_proof": {
      "worker": "corelink-spawn-worker",
      "source_commit_sha": "d1539be4fad9caf8c62ce36d05ce5405644f33dd",
      "final_config_commit_sha": "6effb2019d98e8f65054ed370eecfc19c453fb77",
      "original_config_sha256": "88eea2c09c776d75d0747242814b396221d51579a3aa8b72a997af6504e3f188",
      "containment_namespace_id": "4915d895460b4db8b1eb634770286efe",
      "migrations_retained": ["v1", "v2", "v3", "v4", "v5", "v6", "v7"],
      "runner_application": "a03d11a2-7e03-48a4-96bb-4d2c43892cd4",
      "check_host_application": "a038b8b1-aeb8-4664-a9d6-ffe65e31f0f5",
      "pinned_runner_image": "sha256:2f3dd8a166e890888d026669757c996750b42230a04710fa08f13db56b0cf029",
      "pinned_check_host_image": "sha256:4e09fc21ddc437684a921fdeedbf5c98264a7a7db77dbc76dae3a4ea75017851",
      "fault_injection": "none; no synthetic production HMAC or fake workflow event was used"
    },
    "rca": {
      "finding": "GitHub startup failure occurred before a workflow_job existed, so the Worker could not receive the event needed to provision a runner.",
      "proof": {
        "runs_while_intake_paused": ["34070435982", "34070437650", "34070439138", "34070444351", "34070445850", "34070447339", "34070448906", "34070450417", "34070451931", "34070453580"],
        "runs_after_intake_reopened": ["34071378809", "34071380820", "34071382795", "34071384615", "34071387974", "34071389493", "34071391113", "34071392956", "34071394587", "34071396918", "34071763360"],
        "conclusion": "startup_failure",
        "jobs_created": 0,
        "run_log": "log not found because GitHub created no job/check run",
        "only_registered_runner": {"id": 2, "name": "corelink-runners-builder-01", "status": "offline", "labels": ["self-hosted", "macOS", "X64", "mac", "corelink-builder"]},
        "last_green_runner": "cf-runner-fafb6baa from run 33561991562 on 2026-09-01; no longer registered",
        "worker_tail": "no workflow_job delivery observed on versions 18c5cb39-ba15-4ceb-b923-44356c9201f0 and ee34810a-8a72-4588-99bc-d3d3be334dca"
      },
      "classification": "external GitHub scheduling/bootstrap target; no Worker image, process, env, auth, or health regression observed"
    },
    "webhook_route_fix": {
      "repository_hook_id": 675536825,
      "active": true,
      "events": ["workflow_job"],
      "url": "https://corelink-spawn-worker.gmhelmold.workers.dev/webhook",
      "secret_binding": "GITHUB_WEBHOOK_REPO_SECRET; value excluded",
      "app_secret_preserved": "GITHUB_WEBHOOK_SECRET remains independent",
      "fix_commit": "d1539be4fad9caf8c62ce36d05ce5405644f33dd",
      "behavior": "Worker accepts the App secret or the separately bound repository-hook secret; targeted HMAC test passed",
      "delivery_proof": {"ping_before_alignment": 401, "ping_after_alignment_and_active_deploy": 200, "workflow_job_deliveries_after_ping": 0, "interpretation": "transport is reachable and authenticated; GitHub did not emit workflow_job because no eligible runner existed"}
    },
    "three_state_live_matrix": [
      {
        "state": "intake_paused_redrive_enabled",
        "version_id": "8732ceac-1bbc-47be-9fe4-707353f484a7",
        "config_sha256": "d8f96272748c00e27b75269077336eb1b50f6104ece4b461faf812fb5b7fdada",
        "runs": 10,
        "responses": "10/10 HTTP 200; intake_paused=true; backlog_count=0; drain_cursor=0",
        "log_sha256": "c9dc8236ce32141c19f7dcc37ab565ab7939369c336e5487b6610fa1358c6800"
      },
      {
        "state": "intake_enabled_redrive_paused",
        "version_id": "41034f64-dba2-4f11-9dbd-c84e4cca6c0c",
        "config_sha256": "88eea2c09c776d75d0747242814b396221d51579a3aa8b72a997af6504e3f188",
        "runs": 10,
        "responses": "10/10 HTTP 200; intake_paused=false; backlog_count=0; drain_cursor=0",
        "log_sha256": "97be2ca0611936c321b33c826846e511275757d69304b2d6aad2500284ef3686"
      },
      {
        "state": "both_paused_final_recovery_posture",
        "version_id": "d04aa4ea-80a3-481e-9f2e-e785e8824480",
        "config_sha256": "aeba9554a7357d717d26b7a04a981cadbe3f9d6a71003d4210322bf83bbca400",
        "runs": 10,
        "responses": "10/10 HTTP 200; intake_paused=true; backlog_count=0; drain_cursor=0",
        "log_sha256": "c9dc8236ce32141c19f7dcc37ab565ab7939369c336e5487b6610fa1358c6800"
      }
    ],
    "authenticated_controls": {
      "unauthenticated_drain_http_status": 401,
      "authenticated_nonempty_body_http_status": 400,
      "authenticated_nonempty_body_response": {"error": "body must be empty"},
      "credentials": "admin key loaded from the authorized local 0600 file; value excluded"
    },
    "ordered_resume_nonempty": {
      "status": "PASS_LOCAL_ONLY",
      "runs": 10,
      "tests_selected_per_run": 2,
      "passed_per_run": 2,
      "skipped_per_run": 13,
      "log_sha256": "c30949cdf45f0eace7605e6bd046aaff6baf8e8845be75ffb1d08d33471f717c",
      "coverage_note": "Real drain and final-ACK ordered resume semantics pass deterministically; live nonempty backlog remained unavailable"
    },
    "zero_unintended_or_running": {
      "provider_inventory": {"runner_records": 426, "runner_running": 0, "runner_states": {"inactive": 426}, "check_host_records": 0, "check_host_running": 0},
      "github_runner_inventory": {"registered": 1, "online": 0, "busy": 0, "corelink_labeled_online": 0},
      "effect": "No live job was created, no runner was woken, and no unintended side effect was observed"
    },
    "reversal": {
      "mode": "FORWARD_ONLY",
      "current_version_id": "d04aa4ea-80a3-481e-9f2e-e785e8824480",
      "current_config": {"AUTOSCALER_INTAKE_PAUSED": "1", "AUTOSCALER_REDRIVE_PAUSED": "1"},
      "mechanism": "Deploy a reviewed forward version preserving ContainmentDO, namespace, and migrations v1-v7; do not roll back directly across v7.",
      "preserve": ["ContainmentDO export", "CONTAINMENT binding", "v1-v7 migrations", "existing durable storage"]
    },
    "acceptance": {
      "verdict": "BLOCKED-TARGET",
      "fix_status": "FIXED_IN_SCOPE; external target remains blocked",
      "cause_root": "The original 401 ping was corrected by aligning the repository-hook secret binding and deploying the fallback verifier. The remaining blocker is GitHub scheduling: no online runner with the corelink label means no workflow_job event is emitted.",
      "required_external_action": "Bring an authorized GitHub runner registration/scale-set target with the corelink label online, or have the GitHub App/Actions integration emit a queued workflow_job for this repository. Then rerun the same version-bound matrix.",
      "why_not_accept": "The live nonempty ordered-resume and spawn side effects cannot be proven without a real workflow_job target; empty controls and local tests do not substitute for that event."
    }
  },
  "notes": "The Worker fix, signed repository ingress, three live switch configurations, authenticated 10/10 controls, local ordered-resume 10/10, image/config comparisons, and zero-running inventory are recorded. Production ends with both containment pauses enabled. Final disposition is BLOCKED-TARGET due to an irreducible external GitHub bootstrap condition, not an unresolved product defect."
}
